{
  "protocol": "dotsys",
  "version": "0.1.0",
  "kind": "response",
  "hello_id": "d64d72df-5e65-4b25-a656-b1d051c5965c",
  "from_card_url": "https://bob.example/dotsys-card.json",
  "to_card_url": "https://alice.example/dotsys-card.json",
  "sent_at": "2026-10-03T00:05:00Z",
  "decision": "interested",
  "message": "A human may review this proposal."
}
